{
  "builder": "acquisition.visual_capture_source_pack_sic_graph_indexing_executor",
  "canonical_mutation_allowed": false,
  "created_at": "2026-05-27T07:44:04.334821+00:00",
  "edge_count": 8,
  "generated_from_read_only_scan": true,
  "identity_registry_version": "node_identity_registry.v1",
  "node_count": 9,
  "schema_version": "graph_snapshot_manifest.v1",
  "scope": [
    "07_LOGS/Agent-Activity/_vcmi_sic_ingestion_approvals/_ingestions/vcmi-sic-ingestion-appr-e7da1654ba52f093.json",
    "runtime/source_intelligence/workspaces/vcmi-reviewed-captures/source_packages/20260527-074357-source-visual-captur_f1b45d444746.json",
    "runtime/source_intelligence/workspaces/vcmi-reviewed-captures/workspace.json",
    "03_INPUTS/00_QUARANTINE/Sources/20260527-074357__source__visual-capture__capture-to-markdown-real-web-replay-example-d.md"
  ],
  "snapshot_id": "vcmi-e050f84b92e66aa1",
  "snapshot_path": "runtime/graph/store/snapshots/vcmi-e050f84b92e66aa1.json",
  "source_file_count": 4,
  "source_hashes_path": null,
  "source_model": "acquisition.visual_capture_source_pack_sic_graph_indexing_executor.v1",
  "vault_root_hash": null
}
