{
  "builder": "acquisition.visual_capture_source_pack_sic_graph_indexing_executor",
  "canonical_mutation_allowed": false,
  "created_at": "2026-05-28T00:11:45.486024+00:00",
  "edge_count": 8,
  "generated_from_read_only_scan": true,
  "identity_registry_version": "node_identity_registry.v1",
  "node_count": 9,
  "schema_version": "graph_snapshot_manifest.v1",
  "scope": [
    "07_LOGS/Agent-Activity/_vcmi_sic_ingestion_approvals/_ingestions/vcmi-sic-ingestion-appr-45b4926d09432788.json",
    "runtime/source_intelligence/workspaces/vcmi-reviewed-captures/source_packages/20260528-001133-source-visual-captur_4d18f3a392bf.json",
    "runtime/source_intelligence/workspaces/vcmi-reviewed-captures/workspace.json",
    "03_INPUTS/00_QUARANTINE/Sources/20260528-001133__source__visual-capture__packaged-capture-action-pass64-full-downstrea.md"
  ],
  "snapshot_id": "vcmi-f712d9b468d70122",
  "snapshot_path": "runtime/graph/store/snapshots/vcmi-f712d9b468d70122.json",
  "source_file_count": 4,
  "source_hashes_path": null,
  "source_model": "acquisition.visual_capture_source_pack_sic_graph_indexing_executor.v1",
  "vault_root_hash": null
}
