{
  "builder": "acquisition.visual_capture_source_pack_sic_graph_indexing_executor",
  "canonical_mutation_allowed": false,
  "created_at": "2026-05-28T07:43:08.805850+00:00",
  "edge_count": 8,
  "generated_from_read_only_scan": true,
  "identity_registry_version": "node_identity_registry.v1",
  "node_count": 9,
  "schema_version": "graph_snapshot_manifest.v1",
  "scope": [
    "07_LOGS/Agent-Activity/_vcmi_sic_ingestion_approvals/_ingestions/vcmi-sic-ingestion-appr-c01147097a4fd9db.json",
    "runtime/source_intelligence/workspaces/vcmi-reviewed-captures/source_packages/20260528-074256-source-visual-captur_008883ba2b73.json",
    "runtime/source_intelligence/workspaces/vcmi-reviewed-captures/workspace.json",
    "03_INPUTS/00_QUARANTINE/Sources/20260528-074256__source__visual-capture__packaged-capture-action-20260528074222.md"
  ],
  "snapshot_id": "vcmi-f71fbba15d1bf81b",
  "snapshot_path": "runtime/graph/store/snapshots/vcmi-f71fbba15d1bf81b.json",
  "source_file_count": 4,
  "source_hashes_path": null,
  "source_model": "acquisition.visual_capture_source_pack_sic_graph_indexing_executor.v1",
  "vault_root_hash": null
}
